DEVICE ID 07cf:6101 on Bus 001 Address 002 =================
 bLength                :   0x12 (18 bytes)
 bDescriptorType        :    0x1 Device
 bcdUSB                 :  0x200 USB 2.0
 bDeviceClass           :    0x0 Specified at interface
 bDeviceSubClass        :    0x0
 bDeviceProtocol        :    0x0
 bMaxPacketSize0        :   0x40 (64 bytes)
 idVendor               : 0x07cf
 idProduct              : 0x6101
 bcdDevice              :  0x100 Device 1.0
 iManufacturer          :    0x1 Error Accessing String
 iProduct               :    0x2 Error Accessing String
 iSerialNumber          :    0x0
 bNumConfigurations     :    0x1
  CONFIGURATION 1: 100 mA ==================================
   bLength              :    0x9 (9 bytes)
   bDescriptorType      :    0x2 Configuration
   wTotalLength         :   0x27 (39 bytes)
   bNumInterfaces       :    0x1
   bConfigurationValue  :    0x1
   iConfiguration       :    0x0
   bmAttributes         :   0xc0 Self Powered
   bMaxPower            :   0x32 (100 mA)
    INTERFACE 0: Vendor Specific ===========================
     bLength            :    0x9 (9 bytes)
     bDescriptorType    :    0x4 Interface
     bInterfaceNumber   :    0x0
     bAlternateSetting  :    0x0
     bNumEndpoints      :    0x3
     bInterfaceClass    :   0xff Vendor Specific
     bInterfaceSubClass :    0x0
     bInterfaceProtocol :   0xff
     iInterface         :    0x0
      ENDPOINT 0x82: Bulk IN ===============================
       bLength          :    0x7 (7 bytes)
       bDescriptorType  :    0x5 Endpoint
       bEndpointAddress :   0x82 IN
       bmAttributes     :    0x2 Bulk
       wMaxPacketSize   :  0x200 (512 bytes)
       bInterval        :    0x0
      ENDPOINT 0x1: Bulk OUT ===============================
       bLength          :    0x7 (7 bytes)
       bDescriptorType  :    0x5 Endpoint
       bEndpointAddress :    0x1 OUT
       bmAttributes     :    0x2 Bulk
       wMaxPacketSize   :  0x200 (512 bytes)
       bInterval        :    0x0
      ENDPOINT 0x83: Interrupt IN ==========================
       bLength          :    0x7 (7 bytes)
       bDescriptorType  :    0x5 Endpoint
       bEndpointAddress :   0x83 IN
       bmAttributes     :    0x3 Interrupt
       wMaxPacketSize   :    0x8 (8 bytes)
       bInterval        :    0x2